,fname,text
0,om,"om.   Moveworks: The Enterprise Copilot Platform             Platform Solutions Customer Stories Resources Company   Request demo   Overview  Product Overview  How it Works  LLM Stack  Enterprise Copilot  Key Features  Creator Studio  Employee Experience Insights  Multilingual Support  Moveworks API  Integration Partners  Triage  Performance Dashboards  Experiences  Answers  Approvals  Concierge  Control Center  Employee Communications  Groups Access  Software Access   By Team  IT  HR  Finance  Facilities  Employee Communications  By Use Case  HR Service Desk  Identity Access Management  IT Service Desk  IT Service Management  Knowledge Management  By Initiative  Cost Reduction  Employee Onboarding  Multilingual Support  Self Service   Resource Center  Blog  Help Center  About us  Careers  Newsroom  Contact us  Trust      Platform Overview  Product Overview  How it Works  LLM Stack  Enterprise Copilot  Key Features  Creator Studio  Employee Experience Insights  Multilingual Support  Moveworks API  Integration Partners  Triage  Performance Dashboards  Experiences  Answers  Approvals  Concierge  Control Center  Employee Communications  Groups Access  Software Access  Solutions By Team  IT  HR  Finance  Facilities  Employee Communications  By Use Case  HR Service Desk  Identity Access Management  IT Service Desk  IT Service Management  Knowledge Management  By Initiative  Cost Reduction  Employee Onboarding  Multilingual Support  Self Service  Customer Stories Resources Resource Center  Blog  Help Center  Company About us  Careers  Newsroom  Contact us  Trust  Request demo         The enterprise copilot platform Automate work with generative AI trained on the world's most advanced large language models. See how   Previous Next Pause Play Cost Reduction  Trusted by the best             Blog Discover how Creator Studio connects people to enterprise systems through natural language. Read the blog   Study In the Total Economic Impact™ study, Forrester finds that Moveworks customers see a 256% three year ROI. Find out how   Guide By connecting Moveworks to your enterprise systems, you can build use cases for every department. Download the guide   Register Now! Join us for Moveworks.global: Connecting AI innovators worldwideNovember 2, 2023 Find out more        AI Copilot  What is an enterprise copilot?  An enterprise copilot is a fluid conversational interface that connects your employees with every business system. It’s built on hundreds of machine learning models, fine-tuned to your enterprise data. Available across every channel and fluent in 100+ languages, your enterprise copilot makes it easier than ever for your employees to get things done.    Learn more          Moveworks for IT Automate 75% of your IT issues Transform your IT department with out-of-the-box capabilities, pre-trained on an ever-growing proprietary dataset of enterprise language. See our IT solutions    Moveworks for HR Get your HR team out of their inbox Answer 100K+ common HR questions at the flip of a switch. Deployed by Moveworks in weeks, not months. New model refreshes daily.     Unlock HR support at scale    Creator Studio Generate any conversational AI use case Empower your developers and service owners to build enterprise-wide conversational AI use cases limited only by their imagination. Connect systems with language    Enterprise Answers Create one centralized knowledge base Combine federated knowledge from 30+ systems and 100+ public sources into one place for employees to search across, powered by semantic search techniques like GPT-3. Deliver enterprise search    Employee Communications Send messages that drive action Craft targeted, interactive communications to keep everyone on the same page directly in chat, so nothing gets lost in their email.                     Make change happen in real time    Employee Experience Insights Prioritize high-impact automation projects Uncover insights into your service desk performance by automatically analyzing the unstructured language in your ticket data.                          Turn requests into action       Broadcom is resolving 57%+ of IT issues while seeing a 40% reduction in incidents with Moveworks  Find out how All Customer Stories     What you need to know about conversational AI  ChatGPT’s captured our imagination. Moveworks’ VP of Machine Learning shares his thoughts. Read the blog   Learn how enterprise IT leaders can get the most out of generative AI and large language models (LLMs). Download the guide   Here are the most important AI terms to know in 2023 and what they mean. Check it out   Automate support with Moveworks. Learn how Moveworks eliminates 75% of your help desk’s workload using large language models (LLMs) and generative AI, like GPT-3. Join our live product tour  ㅤ ㅤ ⠀       Platform Product Overview How it Works What's New Employee Experience Insights Multilingual Support Intelligence Engine Triage Integration Partners Performance Dashboards Solutions IT HR Facilities Finance Employee Communications Resources Resource Center Blog Help Center System Status Sitemap API Docs Company About us Contact us Newsroom Careers Guides Conversational AI strategy Writing knowledge base articles Speed up your help desk Why service desk automation? Knowledge centered service Hybrid work best practices    © 2023 Moveworks, Inc. Privacy policy Security     "
1,om #,"om #.   Moveworks: The Enterprise Copilot Platform             Platform Solutions Customer Stories Resources Company   Request demo   Overview  Product Overview  How it Works  LLM Stack  Enterprise Copilot  Key Features  Creator Studio  Employee Experience Insights  Multilingual Support  Moveworks API  Integration Partners  Triage  Performance Dashboards  Experiences  Answers  Approvals  Concierge  Control Center  Employee Communications  Groups Access  Software Access   By Team  IT  HR  Finance  Facilities  Employee Communications  By Use Case  HR Service Desk  Identity Access Management  IT Service Desk  IT Service Management  Knowledge Management  By Initiative  Cost Reduction  Employee Onboarding  Multilingual Support  Self Service   Resource Center  Blog  Help Center  About us  Careers  Newsroom  Contact us  Trust      Platform Overview  Product Overview  How it Works  LLM Stack  Enterprise Copilot  Key Features  Creator Studio  Employee Experience Insights  Multilingual Support  Moveworks API  Integration Partners  Triage  Performance Dashboards  Experiences  Answers  Approvals  Concierge  Control Center  Employee Communications  Groups Access  Software Access  Solutions By Team  IT  HR  Finance  Facilities  Employee Communications  By Use Case  HR Service Desk  Identity Access Management  IT Service Desk  IT Service Management  Knowledge Management  By Initiative  Cost Reduction  Employee Onboarding  Multilingual Support  Self Service  Customer Stories Resources Resource Center  Blog  Help Center  Company About us  Careers  Newsroom  Contact us  Trust  Request demo         The enterprise copilot platform Automate work with generative AI trained on the world's most advanced large language models. See how   Previous Next Pause Play Cost Reduction  Trusted by the best             Blog Discover how Creator Studio connects people to enterprise systems through natural language. Read the blog   Study In the Total Economic Impact™ study, Forrester finds that Moveworks customers see a 256% three year ROI. Find out how   Guide By connecting Moveworks to your enterprise systems, you can build use cases for every department. Download the guide   Register Now! Join us for Moveworks.global: Connecting AI innovators worldwideNovember 2, 2023 Find out more        AI Copilot  What is an enterprise copilot?  An enterprise copilot is a fluid conversational interface that connects your employees with every business system. It’s built on hundreds of machine learning models, fine-tuned to your enterprise data. Available across every channel and fluent in 100+ languages, your enterprise copilot makes it easier than ever for your employees to get things done.    Learn more          Moveworks for IT Automate 75% of your IT issues Transform your IT department with out-of-the-box capabilities, pre-trained on an ever-growing proprietary dataset of enterprise language. See our IT solutions    Moveworks for HR Get your HR team out of their inbox Answer 100K+ common HR questions at the flip of a switch. Deployed by Moveworks in weeks, not months. New model refreshes daily.     Unlock HR support at scale    Creator Studio Generate any conversational AI use case Empower your developers and service owners to build enterprise-wide conversational AI use cases limited only by their imagination. Connect systems with language    Enterprise Answers Create one centralized knowledge base Combine federated knowledge from 30+ systems and 100+ public sources into one place for employees to search across, powered by semantic search techniques like GPT-3. Deliver enterprise search    Employee Communications Send messages that drive action Craft targeted, interactive communications to keep everyone on the same page directly in chat, so nothing gets lost in their email.                     Make change happen in real time    Employee Experience Insights Prioritize high-impact automation projects Uncover insights into your service desk performance by automatically analyzing the unstructured language in your ticket data.                          Turn requests into action       Broadcom is resolving 57%+ of IT issues while seeing a 40% reduction in incidents with Moveworks  Find out how All Customer Stories     What you need to know about conversational AI  ChatGPT’s captured our imagination. Moveworks’ VP of Machine Learning shares his thoughts. Read the blog   Learn how enterprise IT leaders can get the most out of generative AI and large language models (LLMs). Download the guide   Here are the most important AI terms to know in 2023 and what they mean. Check it out   Automate support with Moveworks. Learn how Moveworks eliminates 75% of your help desk’s workload using large language models (LLMs) and generative AI, like GPT-3. Join our live product tour  ㅤ ㅤ ⠀       Platform Product Overview How it Works What's New Employee Experience Insights Multilingual Support Intelligence Engine Triage Integration Partners Performance Dashboards Solutions IT HR Facilities Finance Employee Communications Resources Resource Center Blog Help Center System Status Sitemap API Docs Company About us Contact us Newsroom Careers Guides Conversational AI strategy Writing knowledge base articles Speed up your help desk Why service desk automation? Knowledge centered service Hybrid work best practices    © 2023 Moveworks, Inc. Privacy policy Security     "
2,om ,"om .   Moveworks: The Enterprise Copilot Platform             Platform Solutions Customer Stories Resources Company   Request demo   Overview  Product Overview  How it Works  LLM Stack  Enterprise Copilot  Key Features  Creator Studio  Employee Experience Insights  Multilingual Support  Moveworks API  Integration Partners  Triage  Performance Dashboards  Experiences  Answers  Approvals  Concierge  Control Center  Employee Communications  Groups Access  Software Access   By Team  IT  HR  Finance  Facilities  Employee Communications  By Use Case  HR Service Desk  Identity Access Management  IT Service Desk  IT Service Management  Knowledge Management  By Initiative  Cost Reduction  Employee Onboarding  Multilingual Support  Self Service   Resource Center  Blog  Help Center  About us  Careers  Newsroom  Contact us  Trust      Platform Overview  Product Overview  How it Works  LLM Stack  Enterprise Copilot  Key Features  Creator Studio  Employee Experience Insights  Multilingual Support  Moveworks API  Integration Partners  Triage  Performance Dashboards  Experiences  Answers  Approvals  Concierge  Control Center  Employee Communications  Groups Access  Software Access  Solutions By Team  IT  HR  Finance  Facilities  Employee Communications  By Use Case  HR Service Desk  Identity Access Management  IT Service Desk  IT Service Management  Knowledge Management  By Initiative  Cost Reduction  Employee Onboarding  Multilingual Support  Self Service  Customer Stories Resources Resource Center  Blog  Help Center  Company About us  Careers  Newsroom  Contact us  Trust  Request demo         The enterprise copilot platform Automate work with generative AI trained on the world's most advanced large language models. See how   Previous Next Pause Play Cost Reduction  Trusted by the best             Blog Discover how Creator Studio connects people to enterprise systems through natural language. Read the blog   Study In the Total Economic Impact™ study, Forrester finds that Moveworks customers see a 256% three year ROI. Find out how   Guide By connecting Moveworks to your enterprise systems, you can build use cases for every department. Download the guide   Register Now! Join us for Moveworks.global: Connecting AI innovators worldwideNovember 2, 2023 Find out more        AI Copilot  What is an enterprise copilot?  An enterprise copilot is a fluid conversational interface that connects your employees with every business system. It’s built on hundreds of machine learning models, fine-tuned to your enterprise data. Available across every channel and fluent in 100+ languages, your enterprise copilot makes it easier than ever for your employees to get things done.    Learn more          Moveworks for IT Automate 75% of your IT issues Transform your IT department with out-of-the-box capabilities, pre-trained on an ever-growing proprietary dataset of enterprise language. See our IT solutions    Moveworks for HR Get your HR team out of their inbox Answer 100K+ common HR questions at the flip of a switch. Deployed by Moveworks in weeks, not months. New model refreshes daily.     Unlock HR support at scale    Creator Studio Generate any conversational AI use case Empower your developers and service owners to build enterprise-wide conversational AI use cases limited only by their imagination. Connect systems with language    Enterprise Answers Create one centralized knowledge base Combine federated knowledge from 30+ systems and 100+ public sources into one place for employees to search across, powered by semantic search techniques like GPT-3. Deliver enterprise search    Employee Communications Send messages that drive action Craft targeted, interactive communications to keep everyone on the same page directly in chat, so nothing gets lost in their email.                     Make change happen in real time    Employee Experience Insights Prioritize high-impact automation projects Uncover insights into your service desk performance by automatically analyzing the unstructured language in your ticket data.                          Turn requests into action       Broadcom is resolving 57%+ of IT issues while seeing a 40% reduction in incidents with Moveworks  Find out how All Customer Stories     What you need to know about conversational AI  ChatGPT’s captured our imagination. Moveworks’ VP of Machine Learning shares his thoughts. Read the blog   Learn how enterprise IT leaders can get the most out of generative AI and large language models (LLMs). Download the guide   Here are the most important AI terms to know in 2023 and what they mean. Check it out   Automate support with Moveworks. Learn how Moveworks eliminates 75% of your help desk’s workload using large language models (LLMs) and generative AI, like GPT-3. Join our live product tour  ㅤ ㅤ ⠀       Platform Product Overview How it Works What's New Employee Experience Insights Multilingual Support Intelligence Engine Triage Integration Partners Performance Dashboards Solutions IT HR Facilities Finance Employee Communications Resources Resource Center Blog Help Center System Status Sitemap API Docs Company About us Contact us Newsroom Careers Guides Conversational AI strategy Writing knowledge base articles Speed up your help desk Why service desk automation? Knowledge centered service Hybrid work best practices    © 2023 Moveworks, Inc. Privacy policy Security     "
3,om about,"om about.   About Us | Moveworks                   Skip to content  Forrester names Moveworks a leader in Chatbot for IT operations. Read the report today. Moveworks named a Forrester leader in Chatbot for IT operations.    main menu  Search for...    Home Platform Product Overview How it Works LLM Stack Enterprise Copilot Creator Studio Employee Experience Insights Moveworks API Multilingual Support Triage Integration Partners Performance Dashboards  Solutions IT IT Service Desk IT Service Management Self Service HR HR Service Desk Employee Onboarding Facilities Finance Employee Communications Cost Reduction Identity Access Management Knowledge Management Multilingual Support Customer Stories Resources Resource Center Blog Help Center Company About us Careers Newsroom Contact us Trust   Demo request skip to content      See Moveworks in action. Schedule a meeting with a Moveworks representative and learn how we can help reduce employee issue resolution from days to seconds.    First Name *      Last Name *      Email *      Company *      Phone      How did you hear about us? *     By checking this box, I agree to receive company news and updates. Learn more in the Privacy Policy.   Thank you. A member of the Moveworks team will be in touch within the next 24 hours.  Close this modal   Go back back to form  back to tab selection         About Moveworks     Moveworks is your generative copilot for work. Employees have one secure conversational interface to take action, search for information, query data, receive notifications, and create content across hundreds of enterprise applications. Brands like Broadcom, Docusign, Databricks, and Palo Alto Networks use Moveworks' GPT-class models, AI-powered analytics, developer tools for custom use cases, and hundreds of integrations to bring conversational automation to all aspects of their business     Platform Our platform uses advanced conversational AI in three powerful ways. First, it understands exactly what employees need, no matter how they ask. Next, it handles the natural flow of conversation without following a script. Finally, it integrates with your entire tech stack meaning it delivers the most relevant solution — automatically, with zero maintenance from your team. Platform page   Moveworks named in the forbes cloud 100         Customers We partner with the world’s most innovative companies. Learn how Palo Alto Networks, Slack, Wellstar, LoanDepot, and more receive tangible ROI with Moveworks. Meet our customers         Our people  Our award-winning culture gives you the trust and resources to do the best work of your career.    Join us             Our founders    Bhavin Shah  Co-founder & CEO  expand  Bhavin Shah is the CEO and Co-Founder of Moveworks. He is a serial entrepreneur with two decades of experience taking companies from inception to scale and from private to public. Prior to Moveworks, he was CEO of Refresh.io, which LinkedIn acquired in 2015. Shah has a Master’s degree in Education, Technology, and Business from Stanford University and a B.S. in Computer Science from the University of California, San Diego.   Vaibhav Nivargi  Co-founder & CTO  expand  Vaibhav Nivargi is the CTO and Co-Founder of Moveworks, where he leads the engineering organization. Prior to Moveworks, Nivargi founded ClearStory Data, a big data and analytics company, and was also one of the early engineers at Aster Data, a pioneering big data company acquired in 2011.  Nivargi has a Master’s degree in Computer Science from Stanford University.   Varun Singh  Co-founder & President  expand  Varun Singh is Vice President of Product and Co-Founder of Moveworks. Prior to Moveworks, Singh was Lead Product Manager at Facebook, where he built enterprise software that helped Facebook scale through a combination of data, machine learning, and chatbots. Singh has a Ph.D. in Engineering and Design Optimization from the University of Maryland, College Park, and a Master’s degree in Engineering and Applied Mathematics from UCLA.   Jiang Chen  Co-founder & CTO, AI  expand  Jiang Chen is Vice President of Machine Learning and Co-Founder of Moveworks. With more than a decade of experience in engineering leadership roles at Google, Airbnb, and Yahoo!, Chen has built breakthrough information retrieval systems, which leverage machine learning to provide optimized search results to billions of users.  Chen holds a Ph.D. in Computer Science from Yale University.            Our investors            More about Moveworks  Blog Get the latest actionable insights on employee support, cost reduction, and the future of conversational AI.   Moveworks Blog Press Explore external coverage, and press releases related to Moveworks news and announcements   Newsroom         Solutions Customers Resources Blog Sitemap  Platform Platform overview Moveworks API System status  Company About us Newsroom Contact us Careers                          image/svg+xml  ©2023 Moveworks, Inc.  Privacy policies     close modal          "
4,om api,"om api.   Moveworks API - Connect systems to deliver support at scale                      Skip to content  Forrester names Moveworks a leader in Chatbot for IT operations. Read the report today. Moveworks named a Forrester leader in Chatbot for IT operations.    main menu  Search for...    Home Platform Product Overview How it Works LLM Stack Enterprise Copilot Creator Studio Employee Experience Insights Moveworks API Multilingual Support Triage Integration Partners Performance Dashboards  Solutions IT IT Service Desk IT Service Management Self Service HR HR Service Desk Employee Onboarding Facilities Finance Employee Communications Cost Reduction Identity Access Management Knowledge Management Multilingual Support Customer Stories Resources Resource Center Blog Help Center Company About us Careers Newsroom Contact us Trust   Demo request skip to content      See Moveworks in action. Schedule a meeting with a Moveworks representative and learn how we can help reduce employee issue resolution from days to seconds.    First Name *      Last Name *      Email *      Company *      Phone      How did you hear about us? *     By checking this box, I agree to receive company news and updates. Learn more in the Privacy Policy.   Thank you. A member of the Moveworks team will be in touch within the next 24 hours.  Close this modal   Go back back to form  back to tab selection         Help — just before you need it.  The Moveworks API allows enterprises to connect their systems with customized automation. Create unique workflows that help every employee get the support they need, instantly.    Get started          Extend the reach of your Moveworks platform  Integrating the Moveworks API into your systems unlocks limitless possibilities. You’ll be able to connect your systems in unprecedented ways, letting you deliver automated support, at scale. Whether that means notifying employees of a system outage, proactively reaching out to new hires on their first day, or assisting a user as soon as their device crashes is up to you.         The support your team needs — no questions asked.      Keep your team productive by automatically sending personalized, targeted messages before they have to ask for help     Support your company’s unique needs with workflows tailored to its systems and processes     Provide your team with a consistent support experience by integrating the Moveworks platform into any system     Moveworks’ new API is a game-changer. Disruptive issues like the ‘blue screen of death’ have become a non-issue for us practically overnight. That’s hours and hours of productivity and frustration prevented before they happen. Stanley Toh Head of End-User Services & Experience, Broadcom           Deliver critical updates from any application           Onboard Employees Instantly Set your employees up for success on day one by providing them with all of the applications, accounts, and forms they need before they have to ask.     Reclaim Unused Software at Scale Only pay for the software licenses your team is using by automatically detecting inactive users.     Resolve Device Issues Before They Happen Get ahead of impending problems with automated, actionable messages to employees.     Deliver Critical Updates Automatically Detect issues as they happen and immediately support your employees through outages, security breaches, and other major disruptions.            FAQs  How do I get started?Contact your Customer Success Team and they’ll give you all the information you need to get started. What if I need technical support?For any technical support questions, email support@moveworks.ai or contact your Customer Success Team. Is the API included for all Moveworks customers?Yes! All Moveworks customers can build with the Moveworks API. Is this open source?No, this is not open source, but if you have any feedback, we’d love to hear it. Please share your thoughts with your Customer Success Team.         Start building today            Solutions Customers Resources Blog Sitemap  Platform Platform overview Moveworks API System status  Company About us Newsroom Contact us Careers                          image/svg+xml  ©2023 Moveworks, Inc.  Privacy policies     close modal            "
