,fname,text
45,om us en product groups access,"om us en product groups access.   Group Access: Easy Distribution List Management | Moveworks             Platform Solutions Customer Stories Resources Company   Request demo   Overview  Product Overview  How it Works  LLM Stack  Enterprise Copilot  Key Features  Creator Studio  Employee Experience Insights  Multilingual Support  Moveworks API  Integration Partners  Triage  Performance Dashboards  Experiences  Answers  Approvals  Concierge  Control Center  Employee Communications  Groups Access  Software Access   By Team  IT  HR  Finance  Facilities  Employee Communications  By Use Case  HR Service Desk  Identity Access Management  IT Service Desk  IT Service Management  Knowledge Management  By Initiative  Cost Reduction  Employee Onboarding  Multilingual Support  Self Service   Resource Center  Blog  Help Center  About us  Careers  Newsroom  Contact us  Trust      Platform Overview  Product Overview  How it Works  LLM Stack  Enterprise Copilot  Key Features  Creator Studio  Employee Experience Insights  Multilingual Support  Moveworks API  Integration Partners  Triage  Performance Dashboards  Experiences  Answers  Approvals  Concierge  Control Center  Employee Communications  Groups Access  Software Access  Solutions By Team  IT  HR  Finance  Facilities  Employee Communications  By Use Case  HR Service Desk  Identity Access Management  IT Service Desk  IT Service Management  Knowledge Management  By Initiative  Cost Reduction  Employee Onboarding  Multilingual Support  Self Service  Customer Stories Resources Resource Center  Blog  Help Center  Company About us  Careers  Newsroom  Contact us  Trust  Request demo      Groups Access Let users create, add to, and edit distribution lists – just by chatting with Moveworks.    Previous Next Pause Play Text 1  Trusted by CIOs and employee experience leaders everywhere           Home Product    Groups Access     Provide a seamless experience for your users. The best UI is through your own natural language. It doesn’t matter how your users phrase their questions – whether it’s generic like “edit a list” or hyper-specific like “Please remove Marc Thompson from the sales@acme.ai email distribution list” – Moveworks can understand their underlying intent.                                                                                       Ensure your approvals workflows are honored. Whether it’s creating a new list, adding themselves or others, or removing themselves or others, Moveworks incorporates your existing group access configuration and allows you to modify them.            Automate the last mile & maintain compliance. Moveworks is integrated with your source of truth email systems and provides access to users by automatically updating the group. To keep a clear audit trail, Moveworks logs every interaction in your ITSM.    Features Groups Access comes packed with features, acting as the conversational layer between users and distribution list management. Generic request disambiguation Fuzzy match Approval workflows Approval notifications Removal notifications    Generic request disambiguation If the user doesn’t specify which group, Moveworks provides options through chat-modal forms and lets the user decide.     Fuzzy match The user can respond in natural language, without needing to click any buttons or copy the exact text of the DL, and Moveworks still understands.               Approval workflows Configure logic related to an employee’s role (e.g. “is manager”), an existing group member, and group owner, automatic provisioning without approvals, and more for each list.     Approval Notifications Based on your configured approvals workflows, the correct approver will automatically get notifications with the right level of detail to approve or deny the request in chat.     Removal notifications Users who get removed from a distribution list from someone else automatically receive notifications in chat.      From accessing software to resetting MFA credentials, 1.Bot means we don't have to have service desk agents working on these requests. Moveworks allows my team to pursue new opportunities and projects that wouldn't have been possible before. And for employees, the time savings are tremendous. Stanley Toh Head of End-User Services & Experience       Level up DL management with AI                Guide We analyzed support issues from over 100 companies to help you benchmark your help desk’s performance. Get the guide   Guide Find out why so many companies are using automation to up-level their service desks. Learn why   Blog From “resolution rate” to “issue prevention,” these are the most important metrics to measure the ROI of your virtual agent. Read the blog   Excited to try Groups Access?              Request a demo      Platform Product Overview How it Works What's New Employee Experience Insights Multilingual Support Intelligence Engine Triage Integration Partners Performance Dashboards Solutions IT HR Facilities Finance Employee Communications Resources Resource Center Blog Help Center System Status Sitemap API Docs Company About us Contact us Newsroom Careers Guides Conversational AI strategy Writing knowledge base articles Speed up your help desk Why service desk automation? Knowledge centered service Hybrid work best practices    © 2023 Moveworks, Inc. Privacy policy Security     "
46,om us en product software access,"om us en product software access.   Software Access: Instant Software Access | Moveworks             Platform Solutions Customer Stories Resources Company   Request demo   Overview  Product Overview  How it Works  LLM Stack  Enterprise Copilot  Key Features  Creator Studio  Employee Experience Insights  Multilingual Support  Moveworks API  Integration Partners  Triage  Performance Dashboards  Experiences  Answers  Approvals  Concierge  Control Center  Employee Communications  Groups Access  Software Access   By Team  IT  HR  Finance  Facilities  Employee Communications  By Use Case  HR Service Desk  Identity Access Management  IT Service Desk  IT Service Management  Knowledge Management  By Initiative  Cost Reduction  Employee Onboarding  Multilingual Support  Self Service   Resource Center  Blog  Help Center  About us  Careers  Newsroom  Contact us  Trust      Platform Overview  Product Overview  How it Works  LLM Stack  Enterprise Copilot  Key Features  Creator Studio  Employee Experience Insights  Multilingual Support  Moveworks API  Integration Partners  Triage  Performance Dashboards  Experiences  Answers  Approvals  Concierge  Control Center  Employee Communications  Groups Access  Software Access  Solutions By Team  IT  HR  Finance  Facilities  Employee Communications  By Use Case  HR Service Desk  Identity Access Management  IT Service Desk  IT Service Management  Knowledge Management  By Initiative  Cost Reduction  Employee Onboarding  Multilingual Support  Self Service  Customer Stories Resources Resource Center  Blog  Help Center  Company About us  Careers  Newsroom  Contact us  Trust  Request demo      Software Access Decrease your software access ticket volume and approval times. Let users get instant access to any piece of software – securely, with conversational AI.    Previous Next Pause Play Text 1  Trusted by CIOs and employee experience leaders everywhere           Home Product    Software Access     Provide a seamless experience for your users. The best UI is through your own natural language. It doesn’t matter how your users phrase their questions – whether it’s generic like “ppt please” or hyper-specific like “Please provide me, Madison Smith, access to the software Microsoft Powerpoint” – Moveworks can understand their underlying intent.    Ensure your access workflows are honored. Whether you’d like to auto-provision software, have IT complete the next final step, incorporate manager approvals, provide a knowledge article, let a user fill out a form, or require them to file a ticket – Moveworks ingests your default workflows and lets you configure them.    Automate the last mile & maintain compliance. Moveworks is integrated with your source of truth identity & access management system and provides access to users by automatically updating the security group tied to the software. To keep a clean audit trail, Moveworks logs every interaction in your ITSM.                                                                                                                                                                Popular Fully Provisionable Applications  Moveworks can provision any application that's supported by your Identity and Access Management System. Below are some of the most popular applications provisioned across our customer base.   AWS CloudBriefingSourceChartIOCloudhealthDatadogDocusignEatclubExpensifyHackerrankInvisionAppJira     LucidchartMarketoMicrosoft ExcelNetsuiteOffice365OmbudPagerdutyPaylocity     Ring CentralSeismicSendbloomSmartSheetSpinnakerSumoLogicThinkingPhonesTrelloWavefrontWebex        Features Software Access comes packed with features, acting as the conversational layer between users and software access management. Alternative suggestions License disambiguation Fuzzy match Access workflows Approval notifications    Alternate suggestions Moveworks uses context from your business to provide different suggestions to users if they ask for software you don’t have.         License disambiguation Help users choose the right applications when multiple kinds of license types are available                 Fuzzy match The user can respond in natural language, without needing to click any buttons or copy the exact text of the DL, and Moveworks still understands.               Access workflows Configure logic for approval owners, the information you’d like to collect (including business justifications), automatic provisioning without approvals, and more for each software.     Approval Notifications Based on your configured approvals workflows, the correct approver will automatically get notifications with the right level of detail to approve or deny the request in chat.      From accessing software to resetting MFA credentials, 1.Bot means we don't have to have service desk agents working on these requests. Moveworks allows my team to pursue new opportunities and projects that wouldn't have been possible before. And for employees, the time savings are tremendous. Stanley Toh Head of End-User Services & Experience       Level up software access management with AI            Guide We analyzed support issues from over 100 companies to help you benchmark your help desk’s performance. Get the guide   Case Study See how Broadcom’s has automatically resolved 75k total IT issues and counting, all of which were previously handled by an outsourced helpdesk See the case study   Blog From “resolution rate” to “issue prevention,” these are the most important metrics to measure the ROI of your virtual agent. Read the blog   Excited to try Software Access?                  Request a demo      Platform Product Overview How it Works What's New Employee Experience Insights Multilingual Support Intelligence Engine Triage Integration Partners Performance Dashboards Solutions IT HR Facilities Finance Employee Communications Resources Resource Center Blog Help Center System Status Sitemap API Docs Company About us Contact us Newsroom Careers Guides Conversational AI strategy Writing knowledge base articles Speed up your help desk Why service desk automation? Knowledge centered service Hybrid work best practices    © 2023 Moveworks, Inc. Privacy policy Security     "
47,om us en product whats new,"om us en product whats new.   Latest Product Updates and Features | Moveworks             Platform Solutions Customer Stories Resources Company   Request demo   Overview  Product Overview  How it Works  LLM Stack  Enterprise Copilot  Key Features  Creator Studio  Employee Experience Insights  Multilingual Support  Moveworks API  Integration Partners  Triage  Performance Dashboards  Experiences  Answers  Approvals  Concierge  Control Center  Employee Communications  Groups Access  Software Access   By Team  IT  HR  Finance  Facilities  Employee Communications  By Use Case  HR Service Desk  Identity Access Management  IT Service Desk  IT Service Management  Knowledge Management  By Initiative  Cost Reduction  Employee Onboarding  Multilingual Support  Self Service   Resource Center  Blog  Help Center  About us  Careers  Newsroom  Contact us  Trust      Platform Overview  Product Overview  How it Works  LLM Stack  Enterprise Copilot  Key Features  Creator Studio  Employee Experience Insights  Multilingual Support  Moveworks API  Integration Partners  Triage  Performance Dashboards  Experiences  Answers  Approvals  Concierge  Control Center  Employee Communications  Groups Access  Software Access  Solutions By Team  IT  HR  Finance  Facilities  Employee Communications  By Use Case  HR Service Desk  Identity Access Management  IT Service Desk  IT Service Management  Knowledge Management  By Initiative  Cost Reduction  Employee Onboarding  Multilingual Support  Self Service  Customer Stories Resources Resource Center  Blog  Help Center  Company About us  Careers  Newsroom  Contact us  Trust  Request demo            WHAT’S NEW AT MOVEWORKS  Check out our latest product releases       October 2022  Introducing Employee Experience Insights The only actionable to-do list for every senior IT leader. The only actionable to-do list for every senior IT leader.The only actionable to-do list for every senior IT leader. Learn more   Prioritize your investments with a lens into the employee Learn how you can get started with Employee Experience Insights. Download the datasheet   April 2022  Introducing Moveworks for HR Moveworks tackles the complexities of HR automation. Learn more   15 new ways AI can support your HR team Learn how you can get started with Moveworks for HR. Download datasheet   March 2022  Announcing the Moveworks API Moveworks launches its first API, letting you proactively solve employee’s issues at scale using automation. Learn more   New support languages added For the first time ever, conversational AI support is available in Chinese, Japanese, and Korean. Learn more   Introducing the Moveworks Control Center Take control of your bot with full visibility into your Moveworks platform. Download datasheet   In case you missed it  Moveworks is the only platform that supports employees with any issue in any language. Find out 8 game-changing things Moveworks can do. Download datasheet   Moveworks helped speed up Hearst’s support process — without compromising its user experience. Read the case study! Learn more   Legendary leaders reveal the technologies and techniques they’re using to build the perfect workplace. Learn more      See Moveworks in action.   Join our live demo          Platform Product Overview How it Works What's New Employee Experience Insights Multilingual Support Intelligence Engine Triage Integration Partners Performance Dashboards Solutions IT HR Facilities Finance Employee Communications Resources Resource Center Blog Help Center System Status Sitemap API Docs Company About us Contact us Newsroom Careers Guides Conversational AI strategy Writing knowledge base articles Speed up your help desk Why service desk automation? Knowledge centered service Hybrid work best practices    © 2023 Moveworks, Inc. Privacy policy Security     "
48,om us en resources guides help desk metrics,"om us en resources guides help desk metrics.   5 Help Desk Metrics and Benchmarks IT Leaders Should Know | Moveworks             Platform Solutions Customer Stories Resources Company   Request demo   Overview  Product Overview  How it Works  LLM Stack  Enterprise Copilot  Key Features  Creator Studio  Employee Experience Insights  Multilingual Support  Moveworks API  Integration Partners  Triage  Performance Dashboards  Experiences  Answers  Approvals  Concierge  Control Center  Employee Communications  Groups Access  Software Access   By Team  IT  HR  Finance  Facilities  Employee Communications  By Use Case  HR Service Desk  Identity Access Management  IT Service Desk  IT Service Management  Knowledge Management  By Initiative  Cost Reduction  Employee Onboarding  Multilingual Support  Self Service   Resource Center  Blog  Help Center  About us  Careers  Newsroom  Contact us  Trust      Platform Overview  Product Overview  How it Works  LLM Stack  Enterprise Copilot  Key Features  Creator Studio  Employee Experience Insights  Multilingual Support  Moveworks API  Integration Partners  Triage  Performance Dashboards  Experiences  Answers  Approvals  Concierge  Control Center  Employee Communications  Groups Access  Software Access  Solutions By Team  IT  HR  Finance  Facilities  Employee Communications  By Use Case  HR Service Desk  Identity Access Management  IT Service Desk  IT Service Management  Knowledge Management  By Initiative  Cost Reduction  Employee Onboarding  Multilingual Support  Self Service  Customer Stories Resources Resource Center  Blog  Help Center  Company About us  Careers  Newsroom  Contact us  Trust  Request demo         5 Help Desk Metrics and Benchmarks IT Leaders Should Know in 2023         The most important responsibility of your IT help desk is to ensure employees get the support they need — quickly. But how do you measure “quick”? To help you contextualize your team’s performance, we analyzed IT ticket data from over 100 companies.  We found a dramatic difference between industry-average and industry-leading companies in their mean time to resolution (MTTR). Industry-leading IT teams solved issues in less than half the time. This is a direct result of several key innovations in the IT support process, particularly the use of automation and AI.   How long are employees waiting for support?  *This data represents a sample with selected type of issues.       In this report, we provide help desk benchmarks for high-touch issues, access requests, troubleshooting questions, approvals, and overall MTTR. Across the board, we see a growing divide between the companies that have leaned into innovation and those that haven’t.    High-touch issues submitted to the help desk  Employees with high-touch issues depend on subject matter experts for solutions. Fixing a broken printer or reconfiguring Salesforce requires more than a single help desk agent.  When it comes to high-touch issues, you might assume that automation might hurt, not help. Instead, we’ve found automation is particularly crucial when it comes to solving high-touch issues.    When employees submit a high-touch issue, how long are they waiting for support?        The difference in wait time between average and leading organizations is nearly 27 hours. Why? Best-in-class organizations triage issues to the right person, improve communications between stakeholders, and accelerate comments. But this can be difficult to manage. With AI, however, companies are able to take much of the friction out of solving these complex functions.  To help employees, you need to first understand what they’re asking for. Using NLU (natural language understanding) and NLP (natural language processing) models, industry-leading companies can significantly speed up complicated processes.    Access issues  There are several use cases — password resets, account unlocks — where it might take an agent minutes to perform the task, but the ticket sits in the queue for hours. Industry-leading companies use this as an opportunity to introduce a back-end automation tool to trigger workflows. The difference is shocking: a 15-hour discrepancy that employees experience whenever they’re locked out of an account.   How long do employees wait for access?        In the age of hybrid work, not all employees are able to walk over to their favorite help desk agent and describe their problem in seconds. Leading companies use AI to transition that experience, seamlessly, to a digital workplace.    Troubleshooting questions  All help desks have a collection of knowledge base articles, documenting solutions that only specialists at the company would know. Innovative leaders use AI to transform these long, hard-to-reach articles into bite-sized solutions.  In conventional organizations, it takes a lot of time and effort from the help desk agent to offer a customized solution to an employee, impacting wait times.    How long do employees wait to get their questions answered?        There’s a 10-hour difference in wait time between companies that leverage automation and those that don’t.  Employees expect personalized solutions, and IT agents spend hours gathering information before coming up with the perfect answer. At leading companies, this process is automated — AI is used to gather all context around employee requests, so help desk agents can have a 360-degree view while answering questions.     The impact of approvals  There are some use cases that need managerial input. But getting a manager’s attention can be tough at times.    How long are employees waiting for approvals?        People wait nearly 40 hours for approvals due to the primary mode of communication: email and siloed support channels. But automated support happens in real time. In this category, leading organizations are able to attack the root of the problem: poor communication.   Industry-leading companies have incorporated conversational AI to bring these requests to an enterprise chat platform, allowing managers to give approvals as soon as they see their employees’ messages.  To move from an average company to one that’s leading the pack, you will have to prioritize the employee experience. Conversational AI is a powerful tool, with limitless applications. It can help your help desk agents eliminate their pain points and significantly reduce employees’ wait times.         Platform Product Overview How it Works What's New Employee Experience Insights Multilingual Support Intelligence Engine Triage Integration Partners Performance Dashboards Solutions IT HR Facilities Finance Employee Communications Resources Resource Center Blog Help Center System Status Sitemap API Docs Company About us Contact us Newsroom Careers Guides Conversational AI strategy Writing knowledge base articles Speed up your help desk Why service desk automation? Knowledge centered service Hybrid work best practices    © 2023 Moveworks, Inc. Privacy policy Security     "
